{
  "artifactId": "scout-brief-card-junichiro-v1-g1",
  "projectId": "junichiro-jackson",
  "cardVersionId": "card-junichiro-v1",
  "runId": "run-junichiro-01",
  "researchVersion": 1,
  "generationVersion": 1,
  "status": "ready",
  "visibility": "public",
  "language": "en-US",
  "title": "Junichiro Jackson — Audio Scout Brief",
  "durationMs": 180000,
  "wordCount": 320,
  "scriptModelId": "gemini-3.5-flash",
  "ttsModelId": "gemini-3.1-flash-tts-preview",
  "speakers": [
    { "speaker": "Scout", "voice": "Kore" },
    { "speaker": "Analyst", "voice": "Puck" }
  ],
  "transcript": {
    "segments": [
      {
        "order": 1,
        "section": "hook",
        "speaker": "Scout",
        "text": "This is Audience Take with a Scout Brief on Junichiro Jackson, an ambitious anime-inspired independent animated project created by Chaz Bottoms with Martian Blueberry and TeamTO. The proof-of-concept teaser follows Junichiro, an ambitious high school junior in near-future Brooklyn navigating athletics and creative ambitions.",
        "claimIds": ["claim-1"],
        "sourceIds": ["src-yt-01"]
      },
      {
        "order": 2,
        "section": "project",
        "speaker": "Analyst",
        "text": "Junichiro Jackson combines nineties anime aesthetics with contemporary hip-hop energy and original music supervision by Coast Contra. The production has secured an official co-production partnership with European animation studio TeamTO, providing a structured production pathway.",
        "claimIds": ["claim-1", "claim-2"],
        "sourceIds": ["src-ks-01"]
      },
      {
        "order": 3,
        "section": "evidence",
        "speaker": "Scout",
        "text": "Our evidence ledger verifies primary trade reporting from Variety and the official series launch at jjseries.com. Public reporting disproves earlier rumors of a Chicago setting, confirming the production is firmly set in Brooklyn.",
        "claimIds": ["claim-2"],
        "sourceIds": ["src-yt-01", "src-ks-01"]
      },
      {
        "order": 4,
        "section": "uncertainty",
        "speaker": "Analyst",
        "text": "From a development perspective, domestic and international SVOD streaming distribution windows remain the primary open diligence question as pilot production progresses.",
        "claimIds": ["claim-3"],
        "sourceIds": ["src-trade-01"]
      },
      {
        "order": 5,
        "section": "pathways",
        "speaker": "Scout",
        "text": "The recommended development pathway focuses on packaging an episodic series bible for domestic buyers alongside TeamTO's established animation infrastructure.",
        "claimIds": ["claim-1", "claim-3"],
        "sourceIds": ["src-trade-01"]
      },
      {
        "order": 6,
        "section": "next_move",
        "speaker": "Analyst",
        "text": "The next actionable diligence step is rights and distribution verification, confirming windowing terms before advancing to full writer packaging.",
        "claimIds": ["claim-3"],
        "sourceIds": ["src-trade-01"]
      }
    ],
    "limitations": [
      "Production timeline subject to studio co-financing agreements.",
      "International rights distribution depends on animation windowing approvals."
    ],
    "disclosure": "AI-generated Scout Brief based on the cited Scout Card and verified public evidence."
  },
  "sourceIds": ["src-yt-01", "src-ks-01", "src-trade-01"],
  "claimIds": ["claim-1", "claim-2", "claim-3"],
  "pathwayIds": ["pathway-1", "pathway-2", "pathway-3"],
  "storagePath": "public/projects/junichiro-jackson/scout-briefs/card-junichiro-v1/g1.wav",
  "audioUrl": "/api/scout-briefs/scout-brief-card-junichiro-v1-g1/audio",
  "mimeType": "audio/wav",
  "sizeBytes": 10752044,
  "sha256": "e3b0c44298fc1c149afbf4c8996fb92427ae41e4649b934ca495991b7852b855",
  "generatedAt": "2026-09-06T12:00:00Z"
}
